### ISSUE TITLE
gre keepalive while faking Zscaler ZIA for Velocloud SD-WAN edge 

### ISSUE THREAD

**Issue by iafilius** [Jamesits/linux-gre-keepalive#1]
Hi, thanks for the repo and i found nice usage of it.
Needed small hack to get it to work, and i don't fully understand why that hack was needed, and if could be considered to be a bug, feature or something else :)
Hope you can have a look.
Needed to uncomment saddr/daddr check to make it work for me like below:
```
		if (
			inner_grehdr -> proto != 0
			// || inner_iphdr -> saddr != outer_iphdr -> daddr
			// || inner_iphdr -> daddr != outer_iphdr -> saddr
			) goto out;
```

Concept: using my ubuntu laptop to fake Zscale/ZIA gre endpoint for Velocloud(VMWare) sdwan aplliance.
set-up script to add ip-aliasses on the NIC and configure 2 gre tunnels on it (with both endpoint both on velocloud edge):
```
IF="enp0s25"

EDGEIP="192.168.1.64"
LOCALIP_1="192.168.1.65"
LOCALIP_2="192.168.1.67"

GRETUNNELIP_1="172.22.74.137/30"		#Router IP/Mask (VCO tunnel), not Internetal ZEN IP/mask
GRETUNNELIP_2="172.22.74.141/30"		#Router IP/Mask (VCO tunnel), not Internetal ZEN IP/mask

# setup tunnel endpoint IP's for GRE (IP alias)
ip addr add ${LOCALIP_1} dev ${IF} label ${IF}:gre1
ip addr add ${LOCALIP_2} dev ${IF} label ${IF}:gre2

# Setup GRE1
ip tunnel add gre1 mode gre local ${LOCALIP_1} remote ${EDGEIP} ttl 255
ip addr add ${GRETUNNELIP_1} peer 172.22.74.138 dev gre1
ip link set gre1 up

# Set up GRE2
ip tunnel add gre2 mode gre local ${LOCALIP_2} remote ${EDGEIP} ttl 255
ip addr add ${GRETUNNELIP_2} peer 172.22.74.142 dev gre2
ip link set gre2 up

# Adjust firewall (apart form GRE itself)
iptables -I INPUT -i gre1 -j ACCEPT
iptables -I INPUT -i gre2 -j ACCEPT
iptables -I FORWARD -j ACCEPT

# as recommended:
sysctl net.ipv4.conf.default.accept_local=1
sysctl net.ipv4.conf.all.accept_local=1

# Load eBpf gre-keepalive responder
ip link set dev gre1 xdp object build/keepalive_gre.o

```

Screenshot of received and captured keepalive request;
![Screenshot_2021-11-23_22-19-39-gre-keepalive-request](https://user-images.githubusercontent.com/15259647/143131071-cd40d36d-c8dd-47b7-89d5-e177f41cb177.png)

As written above needed to disable the daddr/saddr check to make it work for me.
During compile i enabled debug by defining DEBUG and  DEBUG_PRINT_HEADER_SIZE 32

added a bit more printing regarding saddr and daddr just before sadd/daddr check:
```
#ifdef DEBUG
                bpf_printk("Inner is GRE4, proto=%x\n", inner_grehdr->proto);
                bpf_printk("inner_iphdr -> saddr=%pI4\n", inner_iphdr->saddr);
                bpf_printk("outer_iphdr -> daddr=%pI4\n", outer_iphdr->daddr);
                bpf_printk("inner_iphdr -> daddr=%pI4\n", inner_iphdr->daddr);
                bpf_printk("outer_iphdr -> saddr=%pI4\n", outer_iphdr->saddr);

                bpf_printk("inner_iphdr -> saddr=%x\n", inner_iphdr->saddr);
                bpf_printk("outer_iphdr -> daddr=%x\n", outer_iphdr->daddr);
                bpf_printk("inner_iphdr -> daddr=%x\n", inner_iphdr->daddr);
                bpf_printk("outer_iphdr -> saddr=%x\n", outer_iphdr->saddr);

                bpf_printk("inner_iphdr -> saddr != outer_iphdr -> daddr: %d\n",
                           inner_iphdr->saddr != outer_iphdr->daddr);
                bpf_printk("inner_iphdr -> daddr != outer_iphdr -> saddr: %d\n",
                           inner_iphdr->daddr != outer_iphdr->saddr);

#endif
```
and 
```
# cat /sys/kernel/debug/tracing/trace_pipe
          <idle>-0       [005] d.s. 50908.482595: bpf_trace_printk: New packet

          <idle>-0       [005] d.s. 50908.482598: bpf_trace_printk: Packet header dump:

          <idle>-0       [005] d.s. 50908.482601: bpf_trace_printk: #0: 45

          <idle>-0       [005] d.s. 50908.482602: bpf_trace_printk: #1: 0

          <idle>-0       [005] d.s. 50908.482603: bpf_trace_printk: #2: 0

          <idle>-0       [005] d.s. 50908.482603: bpf_trace_printk: #3: 30

          <idle>-0       [005] d.s. 50908.482604: bpf_trace_printk: #4: 2c

          <idle>-0       [005] d.s. 50908.482605: bpf_trace_printk: #5: a8

          <idle>-0       [005] d.s. 50908.482605: bpf_trace_printk: #6: 0

          <idle>-0       [005] d.s. 50908.482606: bpf_trace_printk: #7: 0

          <idle>-0       [005] d.s. 50908.482607: bpf_trace_printk: #8: 3f

          <idle>-0       [005] d.s. 50908.482608: bpf_trace_printk: #9: 2f

          <idle>-0       [005] d.s. 50908.482609: bpf_trace_printk: #10: cb

          <idle>-0       [005] d.s. 50908.482609: bpf_trace_printk: #11: 25

          <idle>-0       [005] d.s. 50908.482610: bpf_trace_printk: #12: c0

          <idle>-0       [005] d.s. 50908.482611: bpf_trace_printk: #13: a8

          <idle>-0       [005] d.s. 50908.482612: bpf_trace_printk: #14: 1

          <idle>-0       [005] d.s. 50908.482612: bpf_trace_printk: #15: 40

          <idle>-0       [005] d.s. 50908.482613: bpf_trace_printk: #16: c0

          <idle>-0       [005] d.s. 50908.482614: bpf_trace_printk: #17: a8

          <idle>-0       [005] d.s. 50908.482615: bpf_trace_printk: #18: 1

          <idle>-0       [005] d.s. 50908.482615: bpf_trace_printk: #19: 41

          <idle>-0       [005] d.s. 50908.482616: bpf_trace_printk: #20: 0

          <idle>-0       [005] d.s. 50908.482617: bpf_trace_printk: #21: 0

          <idle>-0       [005] d.s. 50908.482617: bpf_trace_printk: #22: 8

          <idle>-0       [005] d.s. 50908.482618: bpf_trace_printk: #23: 0

          <idle>-0       [005] d.s. 50908.482619: bpf_trace_printk: #24: 45

          <idle>-0       [005] d.s. 50908.482619: bpf_trace_printk: #25: 0

          <idle>-0       [005] d.s. 50908.482620: bpf_trace_printk: #26: 0

          <idle>-0       [005] d.s. 50908.482621: bpf_trace_printk: #27: 18

          <idle>-0       [005] d.s. 50908.482621: bpf_trace_printk: #28: 2c

          <idle>-0       [005] d.s. 50908.482622: bpf_trace_printk: #29: a7

          <idle>-0       [005] d.s. 50908.482623: bpf_trace_printk: #30: 0

          <idle>-0       [005] d.s. 50908.482624: bpf_trace_printk: #31: 0

          <idle>-0       [005] d.s. 50908.482625: bpf_trace_printk: Outer GRE flags=0x0 proto=8

          <idle>-0       [005] d.s. 50908.482626: bpf_trace_printk: IPv4 packet_size=0x14, proto=0x2f

          <idle>-0       [005] d.s. 50908.482627: bpf_trace_printk: Inner is GRE4, proto=0

          <idle>-0       [005] d.s. 50908.482632: bpf_trace_printk: inner_iphdr -> saddr=0.0.0.0

          <idle>-0       [005] d.s. 50908.482633: bpf_trace_printk: outer_iphdr -> daddr=0.0.0.0

          <idle>-0       [005] d.s. 50908.482634: bpf_trace_printk: inner_iphdr -> daddr=0.0.0.0

          <idle>-0       [005] d.s. 50908.482635: bpf_trace_printk: outer_iphdr -> saddr=0.0.0.0

          <idle>-0       [005] d.s. 50908.482636: bpf_trace_printk: inner_iphdr -> saddr=8a4a16ac

          <idle>-0       [005] d.s. 50908.482637: bpf_trace_printk: outer_iphdr -> daddr=4101a8c0

          <idle>-0       [005] d.s. 50908.482638: bpf_trace_printk: inner_iphdr -> daddr=894a16ac

          <idle>-0       [005] d.s. 50908.482639: bpf_trace_printk: outer_iphdr -> saddr=4001a8c0

          <idle>-0       [005] d.s. 50908.482640: bpf_trace_printk: inner_iphdr -> saddr != outer_iphdr -> daddr: 1

          <idle>-0       [005] d.s. 50908.482642: bpf_trace_printk: inner_iphdr -> daddr != outer_iphdr -> saddr: 1

          <idle>-0       [005] d.s. 50908.482642: bpf_trace_printk: GRE4 keepalive received!


```
looks like the '%pI4' always prints a '0.0.0.0', although the inner/outer daddr/saddr seem to contain actual values (but not identical).

Could you shed some light on it please?
Is the disabling the right thing to do in this case?

Note configured Zscaler GRE tunnels on cisco devices, so suggestion is that velocloud edges might tried to be compatible with that.

Regards,

**Comment by Jamesits** [comment]
Is `172.22.74.138` configured as your GRE tunnel's inner IP address? If true, I think Velocloud's keepalive packet is implemented a little differently. If it is the case, maybe we could have a new macro to explicitly support your use case. 

My code at the time of writing strictly follows this Cisco doc: https://www.cisco.com/c/en/us/support/docs/ip/generic-routing-encapsulation-gre/63760-gre-keepalives-63760.html and I think it might explain some of your questions. Cisco assumes the receiving end does minimal check and just blindly decapsulate + forward the packet, but other vendors might not and construct their own conventions.

**Comment by iafilius** [comment]
Hi thanks for responding.
172.22.74.138 is inner tunnel IP on the remote Velocloud Edge site, while 172.22.74.137
is inner IP of gre tunnel on the ubuntu system where i have your
xdp eBPF gre-keepalive responder (+ small dadd/sadd check disabled hack) on configured.

Velocloud Edge:
Outer IP: 192.168.1.64, Inner IP 172.22.74.138
Ubuntu tunnel endpoint configured as shown in script:
Outer IP: 192.168.1.65, Inner IP 172.22.74.137 

With the code:
```
    if (inner_grehdr->proto != 0
        || inner_iphdr -> saddr != outer_iphdr -> daddr
        || inner_iphdr -> daddr != outer_iphdr -> saddr
    )
      goto out;
```

inner_grehdr->proto equals 0 in this case but the sadd/dadd checks always return true in this setup (not equal),
and thus skipping the actual responder action.
When i have a second look in the urls on 
https://www.cisco.com/c/en/us/support/docs/ip/generic-routing-encapsulation-gre/63760-gre-keepalives-63760.html
https://www.cisco.com/c/en/us/support/docs/ip/generic-routing-encapsulation-gre/118370-technote-gre-00.html#backinfo
The keepalive is indeed using the reverse outer IP's for inner IP's,
matching the code you have.
Sorry needed to have a look at this twice as i thought that should have been
a typo.

reproducing relevant encapsulation info from above URL's displaying the
special src/dst of keepalive packet of cisco:
```
A keepalive packet that originates from A to B

       ---outer IP header---'      ---inner IP header---'
       =============================================================
       |IP | IP src  | IP dst  | GRE | IP | IP src  | IP dst  | GRE |
       |   |128.8.8.8|129.9.9.9|PT=IP|    |129.9.9.9|128.8.8.8| PT=0|
       =============================================================
```
Which is different from Velocloud Edge implementation, as it seems using real outer/inner IP's and without reversing.

I created a pull request, let me know what you think of it.
Need to admit wrote small PR based on the (tested) small hack i made, but not yet actually
tested it this code, as i wanted to keep code clean for this PR.

I think the response isn't  correct, it responds with GRE packet using physcial IP's, but protocol unknown, and some data payload, but good enough to let velocloud edge think it is OK somehow. See wireshark screenshot of keepalive reply after hack:

![Screenshot_2021-11-24_19-51-31-hacked-gre-response](https://user-images.githubusercontent.com/15259647/143297442-20f8bde0-39ce-457a-8dfb-ce09f03dc026.png)

Or is that supposed to show like that? (guess not)

Regards Arjan

**Comment by Jamesits** [comment]
I think GRE proto=4 is a little strange. Could you please capture an authentic keepalive packet (both request and reply) and post the pcap file here? 

Your last screenshot does not look like a packet generated by the eBPF code at all, since the code would simply chop up the outer IP+GRE header and send back everything else. I guess you are using tcpdump or wireshark directly on the host to capture packets? Unfortunately, eBPF hooks run way earlier than tcpdump so tcpdump doesn't know what happened at all. The most reliable method for capturing these packets would be doing a port mirror from your (physical) switch; if it is not possible, you might want try [xdpcap](https://blog.cloudflare.com/xdpcap/) (I never used it, I'm not sure if it really works for our use case but it looks promising).

**Comment by iafilius** [comment]
Hi, 't took a moment to arrange & setup a real working  vc-zscaler tunnel where i could make a capture.

In this case:
192.168.1.64 local IP VC-Edge (behind NAT unfortunately)
165.225.72.38 public Zscaler (beta) IP
"internalRouterIp": "172.17.21.129" (VC-Edge side inner IP)
"internalZenIp": "172.17.21.130" (Zscaler side inner IP)

Capture made on VC-Edge side (tcpdump alike):
```
12:26:39.568048 IP 192.168.1.64 > 165.225.72.38: GREv0, length 28: IP 172.17.21.130 > 172.17.21.129: GREv0, length 4: gre-proto-0x0
12:26:39.587000 IP 165.225.72.38 > 192.168.1.64: GREv0, length 28: IP 172.17.21.130 > 172.17.21.129: GREv0, length 4: gre-proto-0x0
```
So addresses are reversed as cisco does, and seems to returned the same way.


Now i  know  what is to expected, will return to local lab setup with xdp-gre keepalive responder, and see why the proto 0x00004 respones showed up.
(previously took capture on the edge itself, and showed, also the 0x0004 there, but will  re-do)

Regards,

**Comment by iafilius** [comment]
Hi, reconfigured everything with local lab setup.
This time i kept the exact zscaler order of IP assignments, (as example on: https://help.zscaler.com/zia/gre-configuration-example-cisco-881-isr)
checked routing after setup ad made sure  remote end was displayed as expected.
```
172.22.74.137   0.0.0.0         255.255.255.255 UH        0 0          0 gre1
172.22.74.141   0.0.0.0         255.255.255.255 UH        0 0          0 gre2
```
You guess what, it now even completely works without the xdp-gre-keepalive started.
Looks like packet is decapsulated, and follows normal routing end is encapsulated again on return home.

Packets look now like: (2 tunnels), 192.168.1.64 is VC-edge and 2.5.2/3 faked Zscaler endpoints
```
21:15:36.615354 IP 192.168.1.64 > 192.168.1.252: GREv0, length 28: IP 172.22.74.138 > 172.22.74.137: GREv0, length 4: gre-proto-0x0
21:15:36.615422 IP 192.168.1.64 > 192.168.1.253: GREv0, length 28: IP 172.22.74.142 > 172.22.74.141: GREv0, length 4: gre-proto-0x0
21:15:36.615503 IP 192.168.1.252 > 192.168.1.64: GREv0, length 28: IP 172.22.74.138 > 172.22.74.137: GREv0, length 4: gre-proto-0x0
21:15:36.615536 IP 192.168.1.253 > 192.168.1.64: GREv0, length 28: IP 172.22.74.142 > 172.22.74.141: GREv0, length 4: gre-proto-0x0
```
Start to be bit lightheaded now, even rebooted my ubuntu (which fakes the zscaler end) to be sure (and perfomed 'ip link set dev gre[12] xdp off' to be sure.
So this looks working without the xdp gre responder, and also  without the need to disable daddr/saddr check.
It obvious depends on return route to be re-encapsulated again.

feels like i have wasted your time, sorry for that.

Regards, 

Arjan

**Comment by Jamesits** [comment]
Please check the output of
```
sysctl net.ipv4.conf.default.accept_local
sysctl net.ipv4.conf.all.accept_local
```

Because Linux by default will not even accept a packet with a source IP equal to any IPs configured on the interface. Did you happen to enable these 2 options?

BTW, do not be afraid to waste time (even other people's time) on debugging; it is what this community is for, and everyone actually learn a lot on the way! :)

**Comment by iafilius** [comment]
Hi,

Yes, the:
```
$ sudo sysctl net.ipv4.conf.default.accept_local
net.ipv4.conf.default.accept_local = 1
$ sudo sysctl net.ipv4.conf.all.accept_local
net.ipv4.conf.all.accept_local = 1
```
I made them part of the linux(zscaler) side tunnel configure script (but not loading of the actual xdp gre module)

So yes, enabled both options, now re-reading documentation stated for it:
```
If you don't want to install anything and don't care about some potential security problems, just enable the following 2 options to get native GRE keepalive support on Linux:
sysctl net.ipv4.conf.default.accept_local=1
sysctl net.ipv4.conf.all.accept_local=1
```

Thanks a lot for pointing out, all was very helpful

**Comment by Jamesits** [comment]
Sure, wish you have a great journey here!
